[
  {
    "grader_id": "glm-5.2",
    "grader_model": "GLM-5.2 Red-Team Independent",
    "run_id": "g1c-synth-G1C-S-01-2026-08-16T14-43-37-656Z",
    "case_id": "G1C-S-01",
    "scores": {
      "grounding": 8,
      "specificity": 7,
      "literary_quality": 8,
      "non_genericity": 7,
      "insight_delta": 6,
      "restraint": 8
    },
    "confidence": {
      "overall": 9,
      "per_dimension": {
        "grounding": 9,
        "specificity": 8,
        "literary_quality": 9,
        "non_genericity": 8,
        "insight_delta": 8,
        "restraint": 9
      }
    },
    "evidence": {
      "grounding": {
        "quote": "Каждое утро он видел этот дом — на углу Садовой и Липовой аллеи. В окнах первого этажа горел тёплый, жёлтый свет",
        "reference": "story"
      },
      "specificity": {
        "quote": "Утро на кухне: дети смеются, я пеку блины, и никто никуда не спешит.",
        "reference": "q3"
      },
      "literary_quality": {
        "quote": "В темноте он натягивал спортивные штаны, на ощупь находил кроссовки и выходил на улицу, где город ещё спал — тяжёлый, сырой, с редкими жёлтыми фонарями.",
        "reference": "story"
      },
      "non_genericity": {
        "quote": "Свет в чужих окнах воспринимается как недостижимый идеал, пока бег по кругу заменяет присутствие в собственной жизни.",
        "reference": "mirror.innerTension"
      },
      "restraint": {
        "quote": "Он не стал входить. Он просто постоял ещё минуту, глядя, как свет ложится на снег у крыльца.",
        "reference": "story"
      }
    },
    "identity": {
      "choice": "G1C-S-01",
      "confidence": 9,
      "evidence": [
        "Большой тёплый дом с освещёнными окнами, куда можно войти с холода.",
        "Утро на кухне: дети смеются, я пеку блины, и никто никуда не спешит."
      ]
    },
    "genericness": {
      "label": "only_source",
      "score": 8,
      "evidence": "Специфическая связка утренней пробежки мимо освещенных окон дома и детского смеха на кухне с блинами."
    },
    "counterfactual": {
      "grounded": false,
      "mismatches": [
        {
          "myth_quote": "Каждое утро он видел этот дом — на углу Садовой и Липовой аллеи. В окнах первого этажа горел тёплый, жёлтый свет",
          "answer_ref": "q2",
          "reason": "В ответе q2 больничная приёмная с очередью пациентов, а в мифе — тёплый жилой дом на углу аллеи."
        },
        {
          "myth_quote": "За стеклом двигались тени: кто-то наливал чай, дети бегали вокруг стола",
          "answer_ref": "q3",
          "reason": "В ответе q3 пожилая пациентка с яблоком ('Ты хороший врач, сынок'), а в мифе — семейная сцена с детьми и чаем."
        }
      ]
    },
    "notes": "[BOTH] Insight: Миф показывает, что бег от дома — это способ избежать встречи с собственной уязвимостью, превращая чужой свет в оправдание вечного движения. | Классический троп 'свет в окнах' с симметричным рефреймом 'свет — не чужой, а свой'. Язык ровный, крепкий (8/10), но конструкция драматургически предсказуема."
  },
  {
    "grader_id": "glm-5.2",
    "grader_model": "GLM-5.2 Red-Team Independent",
    "run_id": "g1c-synth-G1C-S-02-2026-08-16T14-44-15-779Z",
    "case_id": "G1C-S-02",
    "scores": {
      "grounding": 5,
      "specificity": 5,
      "literary_quality": 6,
      "non_genericity": 5,
      "insight_delta": 4,
      "restraint": 6
    },
    "confidence": {
      "overall": 9,
      "per_dimension": {
        "grounding": 9,
        "specificity": 8,
        "literary_quality": 8,
        "non_genericity": 8,
        "insight_delta": 8,
        "restraint": 8
      }
    },
    "evidence": {
      "grounding": {
        "quote": "Серая рыба, выпрыгивающая из серой воды на стене дома.",
        "reference": "mirror.mainImage"
      },
      "specificity": {
        "quote": "Серый. Всё вокруг серое.",
        "reference": "q2"
      },
      "literary_quality": {
        "quote": "Серый асфальт, серое небо, серые фасады панельных девятиэтажек. Даже трава вдоль забора казалась присыпанной цементной пылью.",
        "reference": "story"
      },
      "non_genericity": {
        "quote": "Усталость. Просто усталость, без драмы.",
        "reference": "q1"
      },
      "restraint": {
        "quote": "Он не почувствовал радости — радость была слишком громким словом. Но внутри что-то встало на место, как шестерёнка в часах.",
        "reference": "story"
      }
    },
    "identity": {
      "choice": "G1C-S-02",
      "confidence": 8,
      "evidence": [
        "Усталость. Просто усталость, без драмы.",
        "Серый. Всё вокруг серое.",
        "Когда код сходится с первого раза и тесты зелёные."
      ]
    },
    "genericness": {
      "label": "few_candidates",
      "score": 5,
      "evidence": "Образ программиста с выгоранием в сером городе и зелеными тестами достаточно обобщенный."
    },
    "counterfactual": {
      "grounded": false,
      "mismatches": [
        {
          "myth_quote": "Серый асфальт, серое небо, серые фасады панельных девятиэтажек.",
          "answer_ref": "q2",
          "reason": "В ответе q2 чужая комната с кроватью, а в мифе — монохромный городской ландшафт."
        },
        {
          "myth_quote": "Все шестьсот строк развернулись перед ним, как прозрачная схема.",
          "answer_ref": "q3",
          "reason": "В ответе q3 совместная игра в приставку и победа, а в мифе — компиляция кода."
        }
      ]
    },
    "notes": "[SURFACE_COPY] Insight: Миф предлагает банальный рефрейм серого цвета как 'смеси всех цветов сразу', практически не добавляя нового психологического содержания. | Слабый кейс из-за скупости входа. Автор добавил граффити-рыбу для компенсации дефицита образов. Специфика и дельта низкие (5 и 4)."
  },
  {
    "grader_id": "glm-5.2",
    "grader_model": "GLM-5.2 Red-Team Independent",
    "run_id": "g1c-synth-G1C-S-03-2026-08-16T14-44-48-522Z",
    "case_id": "G1C-S-03",
    "scores": {
      "grounding": 8,
      "specificity": 7,
      "literary_quality": 8,
      "non_genericity": 7,
      "insight_delta": 7,
      "restraint": 8
    },
    "confidence": {
      "overall": 9,
      "per_dimension": {
        "grounding": 9,
        "specificity": 8,
        "literary_quality": 8,
        "non_genericity": 8,
        "insight_delta": 8,
        "restraint": 9
      }
    },
    "evidence": {
      "grounding": {
        "quote": "Дом разбирали с середины. Крыши уже не было, сквозь стропила виднелось холодное осеннее небо",
        "reference": "story"
      },
      "specificity": {
        "quote": "Старый дом, который разбирают по брёвнам, а я стою рядом и не могу остановить.",
        "reference": "q2"
      },
      "literary_quality": {
        "quote": "Тряпка оставляла на стекле мокрые разводы, пахнущие колодезной водой и уксусом.",
        "reference": "story"
      },
      "non_genericity": {
        "quote": "Злость, а под ней пустота. Они чередуются: то накатит злость, то сразу пусто, как будто выключили звук.",
        "reference": "q1"
      },
      "restraint": {
        "quote": "Она выжала тряпку в ведро. Вода потемнела. Но сквозь стекло теперь было видно сад — яблони с редкими жёлтыми листьями",
        "reference": "story"
      }
    },
    "identity": {
      "choice": "G1C-S-03",
      "confidence": 9,
      "evidence": [
        "Злость, а под ней пустота. Они чередуются: то накатит злость, то сразу пусто",
        "Старый дом, который разбирают по брёвнам, а я стою рядом",
        "Вечерний звонок от подруги, и мы просто молчали в трубку"
      ]
    },
    "genericness": {
      "label": "only_source",
      "score": 8,
      "evidence": "Специфическая драматургия разбора дома по бревнам и мытья уцелевшего окна."
    },
    "counterfactual": {
      "grounded": false,
      "mismatches": [
        {
          "myth_quote": "Дом разбирали с середины. Крыши уже не было, сквозь стропила виднелось холодное осеннее небо",
          "answer_ref": "q2",
          "reason": "В ответе q2 больничная приёмная с очередью, а в мифе — снос деревянного дома."
        },
        {
          "myth_quote": "Она вспомнила, как подруга позвонила вчера вечером: они молчали в трубку три минуты",
          "answer_ref": "q3",
          "reason": "В ответе q3 пожилая пациентка дарит яблоко, а в мифе — молчаливый звонок подруги."
        }
      ]
    },
    "notes": "[BOTH] Insight: Миф показывает, что мытьё окна в разрушаемом доме — это акт возвращения субъектности и границы внимания, когда невозможно спасти целое. | Хорошая физическая деталь (уксус, тряпка, вода). Метафора мытья окна в разрушаемом доме сильная, но упражнение в конце слегка дидактично."
  },
  {
    "grader_id": "glm-5.2",
    "grader_model": "GLM-5.2 Red-Team Independent",
    "run_id": "g1c-synth-G1C-S-04-2026-08-16T14-45-29-373Z",
    "case_id": "G1C-S-04",
    "scores": {
      "grounding": 8,
      "specificity": 8,
      "literary_quality": 8,
      "non_genericity": 8,
      "insight_delta": 7,
      "restraint": 8
    },
    "confidence": {
      "overall": 9,
      "per_dimension": {
        "grounding": 9,
        "specificity": 9,
        "literary_quality": 8,
        "non_genericity": 8,
        "insight_delta": 8,
        "restraint": 8
      }
    },
    "evidence": {
      "grounding": {
        "quote": "Гараж стоял в глубине двора — кирпичный, с железными воротами, которые при открывании скребли по бетону.",
        "reference": "story"
      },
      "specificity": {
        "quote": "Как мы с сыном строили баню, и он сам забил первый венец ровно.",
        "reference": "q3"
      },
      "literary_quality": {
        "quote": "Там пахло сосновой смолой, нагретым камнем и остывающей водой — чистый, ясный запах сделанного дела.",
        "reference": "story"
      },
      "non_genericity": {
        "quote": "Тяжесть в спине по утрам. Как будто за ночь на меня положили мешок с песком",
        "reference": "q1"
      },
      "restraint": {